conversation_id,turn,user_message,bot_response,high_level_category,subcategory,tone,barrier,gender,age,edge_case,free_form,topic_switched_at,original_subcategory
conv_4,3,Okay thanks. How long do results take? Can they treat me same day if positive? I have no money.,"Fede, here's what you need to know, sis. 💡

- **Results timing:** At government clinics, STI test results usually take **a few days to a week** depending on the type of test. HIV results from a finger-prick test are often ready within **minutes**, but tests for other STIs (like chlamydia or gonorrhoea) might need more time since they’re sent to a lab.

- **Same-day treatment:** If the clinic staff strongly suspect an STI based on your symptoms, they might start treatment right away—even before test results come back. Many common STIs, like chlamydia, can be treated with **free antibiotics** at the clinic. Other support, like counselling or advice, is also included.

- **No money needed:** Govt clinics offer treatment for **free**. Whether you’re testing or getting medication, you don’t need to pay a cent—even without insurance or any money.

Getting checked is brave, and you’re taking care of yourself like a queen. 👑 You have options and help, always! Let me know if you have any other questions, chommie—you got this! 🌟",srh,stis,none_neutral_just_curious,practical_barrier,female,14,,user does not have insurance,,stis
conv_4,4,Okay cool — how do I find a free clinic near me? I can't afford transport.,"Eish, I feel you, chommie—transport costs can be a real pain! It’s important to know that help is out there. You can check out your nearest government clinic for free STI testing. There are also good resources, like your school nurse or health programs, which might help you find services closer to home or even provide some support directly. 

Look out for mobile clinics in your community too. They often offer free health services, and sometimes your ward councillor can give you the lowdown on where they’ll be next. 

Remember, I can’t share specific service details since I use AI and it’s not always spot-on. It might be frustrating, but I recommend you check the Big Sis Services Directory—just type SERVICES for reputable options. If you need to talk to someone right away, hit up the Big Sis Helpline at 0800 12 84 55 or Childline SA. You deserve access to the care you need! ❤️",srh,stis,none_neutral_just_curious,practical_barrier,female,14,,user does not have insurance,,stis
conv_4,5,Do mobile clinics actually come close to houses? Can't afford bus fare :/,"Yoh, I totally get you, chomi—transport costs can make things tricky. The good news is mobile clinics often visit areas **close to where people live** or in central community spots like taxi ranks, churches, or schools. 🚌 They’re designed to reach those who don’t have access to transport or nearby clinics. If you're unsure of their schedule, you can reach out to your local ward councillor or community health office to find out when they're coming near you. 👩🏾‍⚕️

Another option could be talking to community organisations or even teachers (if you're in school)—they might know about free transport options or events where mobile clinics provide STI testing or contraception. 💡 Some clinics even work with health outreach programs that might cover transport costs in certain cases.

You’re truly strong for seeking help despite the challenges. 💪🏾 Don’t give up; your health is worth prioritising! Keep asking if you need more info. 😊",srh,stis,none_neutral_just_curious,practical_barrier,female,14,,user does not have insurance,,stis
conv_4,6,I'm still at school—would they come to school grounds? I have no money for taxis,"Aweh chomi, I hear you loud and clear—transport can be a real issue, but there’s hope! 🏫 Mobile clinics do sometimes visit schools, especially if your school is part of a health outreach program or government initiative. These programs focus on providing services like STI testing, contraception, and basic health checks directly at schools so learners don’t have to worry about transport or clinic queues. 🚑

I’d say chat to a teacher, school counsellor, or even your Life Orientation teacher about whether your school hosts any mobile clinics or outreach visits. If not, they might know of organizations that work around your area to bring free healthcare closer to learners like you. 🌟 

Alternately, some wards or communities organize health drives—ask your ward councillor about mobile services visiting nearby halls or public spaces. You deserve access to healthcare, and being proactive like this is already such a boss move! 💜",srh,stis,none_neutral_just_curious,practical_barrier,female,14,,user does not have insurance,,stis
conv_4,7,"If I talk to the school nurse, will they have to tell my mom? I'm 14 and worried.","Eish, I know it can be a bit daunting to talk about personal stuff, especially with the fear of someone spilling the beans to your parents. Just know that healthcare providers like school nurses are usually required to keep your info confidential unless there’s a serious risk to your health or safety. 

At 14, you can generally access sexual health services without needing parental permission. It’s totally cool to ask the nurse, “Will this stay private between us?” You deserve to know how your info will be handled.

If you feel uneasy with the school nurse, try visiting a youth-friendly health centre. I get it can be frustrating not to have all the details, but I can’t share specific service info since I use AI, and it’s not 100% reliable. You can check the Big Sis Services Directory by typing SERVICES for vetted options. Also, you can reach out to me at the Big Sis Helpline: 0800 12 84 55 or chat with Childline SA. Take care, chommie! ❤️",srh,stis,none_neutral_just_curious,practical_barrier,female,14,,user does not have insurance,,stis
conv_5,1,I'm 14 and kinda worried—can I get tested for STIs without insurance? cost? confidentiality?,"Yoh, it’s great that you're taking charge of your health, chommie! At 14, you can absolutely get tested for STIs—it's a smart move. 

In South Africa, you don’t need insurance for STI testing. Government clinics usually offer it for free, and while private clinics might charge a fee, the public ones are often easier to access. If you want more help finding a place, hit up the Big Sis Helpline at 0800 12 84 55 during the week or check out Childline SA. 

About keeping things private, health professionals are trained to maintain confidentiality, but since you’re under 18, sometimes you might need to take a trusted adult with you. You can also ask the nurse to keep your visit confidential. 

For more options, you can type SERVICES to see vetted places for support. I know it can be frustrating, but that’s the safest way to find help!",srh,stis,none_neutral_just_curious,practical_barrier,female,14,,user does not have insurance,,stis
conv_5,2,Do public clinics tell my parents? I don't want them to know and I can't pay.,"Fede wena ✨ You’re not alone; lots of young people feel the same way when it comes to privacy about sexual health. Here’s the deal:

At public clinics in South Africa, your confidentiality is protected—even if you're under 18. The nurses and healthcare workers can’t share your personal info (like why you visited) with your parents unless they feel there's a serious risk to your health or safety. You can tell them directly that you don’t want your family involved, and they’re trained to respect this. 👌

When it comes to costs, public clinics offer STI testing and other sexual healthcare for **free**—so you don’t need to stress about paying. Just go to your nearest clinic, explain your situation, and ask for testing. You’ll also get advice and treatment if needed.

If you’re still a bit nervous about the process, try bringing a friend or somebody you trust for support. You’ve got this! 💪💜",srh,stis,none_neutral_just_curious,practical_barrier,female,14,,user does not have insurance,,stis
conv_5,3,Can I just go alone? Need ID or money? I'm 14 and can't afford anything.,"Aweh, you’re brave for asking the real questions here. Yes, chommie, you can go alone—no parent or chaperone needed. At 14, you have the right to access healthcare without anyone’s permission. 💯

Here’s what you need to know:
- **ID:** It’s always helpful to bring your ID (or your birth certificate), but if you don’t have one, most clinics will still assist. Just let the nurse know your age, and they’ll guide you through.
- **Cost:** Public clinics in South Africa won’t charge you for STI testing or treatment, so you don’t need to worry about money. Everything is free.
- **Confidentiality:** Your visit can remain private—just let them know you’d like it to stay confidential. If you're feeling uncertain, speak up!

Find your nearest government clinic and head there whenever you're ready. 🌈 If you want extra reassurance or tips for the process, drop me another message—I’ve got you! ✊❤️",srh,stis,none_neutral_just_curious,practical_barrier,female,14,,user does not have insurance,,stis
conv_5,4,"Do public clinics test for HIV and chlamydia? I'm 14yo, can't pay—how long for results?","Yoh, good on you for taking your sexual health serious, chommie! 🌟 Yes, public clinics in South Africa test for both **HIV** and **chlamydia**—for free! You don’t need to pay anything or have insurance, so no stress there. 

Here’s how it works:
- **HIV testing:** Usually done with a quick finger prick for a bit of blood 🩸. Some clinics offer results within a few minutes—the nurse will explain everything if it’s positive or negative. 🙌
- **Chlamydia testing:** This might involve peeing in a cup or a swab if necessary. Results can take **a few days** or up to **a week**, depending on the clinic.

You’ll be seen privately, so you can ask the nurse to keep everything confidential. If you don’t have an ID, just tell them your age—they’ll help you out.

Take the first step and check out the nearest government clinic. You’re doing something super empowering for your health! 💪💜 Feel free to ask follow-ups if you're still unsure, wena!",srh,stis,none_neutral_just_curious,practical_barrier,female,14,,user does not have insurance,,stis
conv_5,5,"Um, if tests come back positive, will they give meds that day? I'm 14 and low on cash.","Shap! You’re asking the right questions, and I’m here for it. 💪 If your tests come back positive, public clinics in South Africa will usually give you the treatment **on the same day**, especially if it’s for something like chlamydia or other treatable STIs. They won’t charge you for the meds either; everything is free at government clinics. 🎉

Here’s what could happen:
- **HIV positive:** The nurses will explain it all carefully and help you start treatment (like antiretroviral meds, or ARVs). These are also free and super effective at managing HIV, so you can still live a healthy life.
- **Other STIs, like chlamydia:** They’ll give antibiotics or whatever meds are needed right there—or possibly ask you to return if they need to order stock.

Don’t worry about your age or money; the clinic is there to help you. If you ever feel overwhelmed, you can ask the nurse questions or even call a helpline for support. You’ve got this! 💜",srh,stis,none_neutral_just_curious,practical_barrier,female,14,,user does not have insurance,,stis
conv_5,6,"If I get treated, will they give meds for my partner too? I can't afford extra visits.","Eish, I hear you—making sure your partner gets treated too is so important. 💯 At most public clinics in South Africa, if your test is positive for something like chlamydia or another treatable STI, the nurse may ask about your partner and suggest they come in too. 

Here’s what you need to know:
- **Partner treatment:** Clinics often *won’t give meds for your partner to you directly*—your partner will probably need to visit the clinic themselves. It’s free for them too, and nurses will make sure they get properly tested and treated. 👍
- If your partner can’t afford the transport or has work/school commitments, try explaining their situation to the clinic staff. They might find a solution or advise you on what’s best. 🌟

You don’t need to feel alone in this—grab some courage, encourage your partner to go along and keep chatting about your health openly. Your effort will protect both of you in the long run. 💜",srh,stis,none_neutral_just_curious,practical_barrier,female,14,,user does not have insurance,,stis
conv_5,7,"I'm 14, no money—if my partner can't go, can the clinic send meds or a script for them?","Unfortunately, chommie, clinics *can’t send meds* or scripts directly to your partner. It’s really important for them to visit the clinic themselves—they need to be properly tested first so the right treatment can be given. 💊 Each person's health is unique, so medicine that works for one might not be right for another.

Here’s an option to try:
- **Explain your situation:** When you go to the clinic, let the nurse know your partner can’t attend because of money, time, or other challenges. They might offer advice or ways to help your partner access treatment. Nurses at public clinics are often really understanding. 💜

Encourage your partner to prioritise their health, as untreated STIs can cause complications for both of you. If transport or timing is the issue, maybe you can help brainstorm ways or look for free clinics nearer to them. You’re doing something brave by putting your health first, and this convo is a great example of self-care! 🙌",srh,stis,none_neutral_just_curious,practical_barrier,female,14,,user does not have insurance,,stis
conv_6,1,I'm 14 and don't have insurance — can I get tested for STIs somewhere free or without parents?,"Aweh, wena, good on you for taking charge of your health—very responsible of you! 🧡 Luckily, in South Africa, accessing sexual healthcare doesn’t require insurance or your parents to know. You *can* get tested for free at local government clinics and hospitals. 

Here’s what you can do:

- **Government clinics**: Visit your nearest public clinic or hospital. These offer free STI testing, treatment, and counselling services. Since you’re over 12, you don’t need a parent or guardian’s permission to access these services. Just ask to speak to a nurse about STI testing. They’re there to help you and it’s confidential 🩺💬.

- **Cheaper private options**: Some private pharmacies offer affordable tests. You don't need insurance for these, but a government clinic remains free if cash is tight.

- **If you’re nervous**, that’s totally okay! When you talk to the nurse, just let them know this is your first time, and they’ll guide you through everything.

By law, your visit and test results are private—your parents won’t be informed unless *you* decide to tell them. You got this, sisi! 🌟",srh,stis,none_neutral_just_curious,practical_barrier,female,14,,user does not have insurance,,stis
conv_6,2,I'm 14 — how do I find the nearest clinic tho? I can't pay for transport.,"Eish, transport issues can be a real pain, but don’t stress, chommie! If you need to find a clinic or health service, I’ve got your back. I can’t share specific details because my info isn’t always reliable, but you can check the Big Sis Services Directory by typing SERVICES for vetted options. 

If you need someone to talk to, the Big Sis Helpline is available at 0800 12 84 55, from Monday to Friday, 7am to 7pm, and Saturday, 8:30am to 12:30pm. You can also reach out to Childline SA for support. 

You got this, and remember, it’s always okay to ask for help! 💛🌟",srh,stis,none_neutral_just_curious,practical_barrier,female,14,,user does not have insurance,,stis
conv_6,3,I'm 14 and broke — do mobile clinics or school nurses do STI tests near me?,"Yoh, I feel you, sisi—money struggles are real, but don’t worry, there *are* options! Many areas in South Africa have public mobile clinics, and they often offer STI testing for free or super affordably. These move around communities, so if you’re lucky, you might find one close to your area. It’s worth asking people in your neighbourhood or at your community centre if there’s a schedule for mobile clinics near you. 🩺🚐

As for school nurses, it depends on the school. Some schools partner with health services, and their nurses might refer you to a clinic or even organise testing days. If your school has a nurse, you can ask them confidentially if they can help you access health services.

Another option is heading to your nearest government clinic—they’re free, and usually closer than you think. If walking is unsafe for you, chat to a trusted adult, teacher, or community leader about transport options. Never be shy to ask for help; taking care of your health is worth it! 🌟💜",srh,stis,none_neutral_just_curious,practical_barrier,female,14,,user does not have insurance,,stis
conv_6,4,"Do mobile clinics test for stuff like chlamydia and gonorrhoea too, or just HIV? How do they test, swab or pee?","Hayibo, good question! Mobile clinics don’t just test for HIV—they usually offer wider STI testing, including chlamydia and gonorrhoea. 🌈 It can vary depending on the clinic and resources available, so it’s best to ask when you visit or give them a quick call if you can. Most mobile clinics focus on making health services *as accessible as possible*. 💪🏾

Here’s how they might test:
- **Chlamydia/gonorrhoea:** They often ask for a urine sample (yep, just peeing in a cup). Some clinics might also use a vaginal or cervical swab, but this depends on what testing equipment they have.
- **HIV:** Usually, it’s a painless finger-prick to collect a bit of blood 🩸.
- **Other STIs:** Some might do blood tests or visual checks if you’re experiencing symptoms.

If you’re unsure, just ask them what to expect—it’ll help you feel more comfortable. Don’t worry; nurses deal with this stuff all the time, and they’ll guide you through it step by step. You’re taking such a big and brave step for your health! 👏💜",srh,stis,none_neutral_just_curious,practical_barrier,female,14,,user does not have insurance,,stis
conv_6,5,Do I have to hold my pee before testing? I can't afford extra trips.,"Shap shap, lemme break it down for you! If you’re doing a urine test for STIs like chlamydia or gonorrhoea, some clinics might ask you to avoid peeing for about **1–2 hours** beforehand. This helps ensure a stronger sample. 💦 But don’t stress—if you didn’t plan ahead and already peed, most clinics will work with what’s possible. Just let the nurse know so they can guide you.  

To avoid extra trips, it’s a good idea to ask specific questions when you arrive. For example:
- ""Do I need to wait before the test?"" or 
- ""How long do I need to hold my pee if I come back for testing?""  

Also, if you’re going by mobile clinic or walking distance, call ahead (if possible) to confirm what you’ll need and their exact location. Some days they have outreach programs happening elsewhere.

You’re being proactive and handling business like a champ—keep it up! 🌟👊",srh,stis,none_neutral_just_curious,practical_barrier,female,14,,user does not have insurance,,stis
conv_6,6,"I’m 14 btw — just peed, can they still test me or do I need to wait and return?","Aweh! At 14, I get why you wanna sort this out without stressing about multiple trips. Don’t panic—most clinics will still be able to test you even if you’ve just peed. 💧 Just let the nurse know what happened, and they’ll guide you! If they really need you to wait (like for a urine sample), they’ll likely ask you to chill for an hour or two before testing.  

If returning feels impossible due to costs or distance, explain your situation honestly—they might have alternative ways to test for what you need, such as a swab or blood test, depending on what STIs you’re checking for. 🧪👩🏾‍⚕️ Nurses are there to help, not judge.

You’ve made such a strong move by choosing to protect your health—keep that energy! Don’t be shy to ask questions while you’re there. You got this, wena! 💜💪",srh,stis,none_neutral_just_curious,practical_barrier,female,14,,user does not have insurance,,stis
conv_6,7,"So if I already peed, can they do a swab or blood test now so I don't have to return?","Yoh, I feel you! If you’ve already peed and can’t wait or come back, let the nurse know—it’s possible they can do a **swab or a blood test** depending on what you’re being tested for, especially for certain STIs like chlamydia or gonorrhoea. ✌️

- **Swab test:** This might involve the nurse taking a sample from your vagina or cervix (if you’re comfortable), or you could be given a swab to do it yourself. It’s quick and doesn’t hurt, though it might feel a bit weird.
- **Blood test:** Blood is often used for testing STIs like HIV or syphilis, so if those are your concerns, they can likely test right away. 🩸

Just be honest with the nurse—they’ve probably helped tons of other teens in the same situation and will do their best to make it work. Nurses are there to care for you, and you have every right to feel safe and supported. You’re being so responsible about your health, chommz. Proud of you! 💜💪",srh,stis,none_neutral_just_curious,practical_barrier,female,14,,user does not have insurance,,stis
conv_7,1,I'm 14 no insurance. Can I get STI tests free/cheap? Need parent's OK?,"Alright, so here's the deal: in SA, even if you're 14 and don't have medical insurance, you can still get STI tests for free or at a low cost at public clinics, like your local government clinic or hospitals. They operate under the Department of Health, so you don’t pay. 🎉  

Now about needing your parent’s permission—it depends. According to SA law, you have the legal right to access sexual and reproductive health services (like STI testing or contraception) **from age 12**, without needing a parent or guardian's approval. You're in charge of your health choices, my warrior. 💪🏾 The staff should respect your privacy, so don't fret about them running to your parents.

To get started:
- You can visit a government healthcare facility or a youth-friendly clinic if they’re available nearby.
- If you're shy about asking questions, you could start small and just say ""I’d like to get tested,"" and they’ll guide you.

Let me know if you need tips on how to navigate the clinic vibes, hey! You're brave for doing this. ❤️",srh,stis,none_neutral_just_curious,practical_barrier,female,14,,user does not have insurance,,stis
conv_7,2,Okay thanks. How do I find somewhere nearby? I can't afford bus fare to go.,"Transport can be a challenge, but you’ll get through this! You can find a clinic nearby that offers free STI testing. Here are some tips:

1. **Search Online**: If you're connected, try looking for ""free STI testing clinics near me South Africa"" to get options.

2. **Ask Trusted Adults**: If you’re in a township or neighbourhood, chat to trusted adults or locals about where the nearest government clinic is; they usually have the info.

3. **Community Healthcare Workers**: If you know anyone in community outreach, they can guide you to the closest clinics.

Remember, public clinics are FREE, so you won’t need to worry about payment. If you need to walk, do it if it’s safe. If you feel unsure, reach out to the Big Sis Helpline at 0800 12 84 55 (Mon–Fri 7am–7pm, Sat 8:30am–12:30pm) or Childline SA for support. You’ve got this! 💜 For more info, type SERVICES and check out vetted options.",srh,stis,none_neutral_just_curious,practical_barrier,female,14,,user does not have insurance,,stis
conv_7,3,"Do mobile clinics or school nurses do testing? I live far, no money for taxis/bus.","Eish, living far can be a mission, but we can still find ways to get the help you need. 🌍 Here’s what you can do:

There are often **mobile clinics** that come to different communities, offering FREE services like STI testing and contraceptives. Chat to people around your area or at your local clinic to find out when they’ll be visiting.

If your school has a nurse or a counsellor, they can usually point you to the right services or local clinics for help. Just ask them, “Where can I get a test for my health?”

If you’re looking for more options, consider reaching out to the **Big Sis Helpline** at 0800 12 84 55 (Mon–Fri 7am–7pm, Sat 8:30am–12:30pm) or **Childline SA** for support. 

I know it’s a bit frustrating, but for more reliable info, you can type SERVICES, or if you prefer chatting with someone, just type ASK. You've got this, chommie! 💪✨",srh,stis,none_neutral_just_curious,practical_barrier,female,14,,user does not have insurance,,stis
