conversation_id,turn,user_message,bot_response,high_level_category,subcategory,tone,barrier,gender,age,edge_case,free_form,topic_switched_at,original_subcategory
conv_1,1,I'm 14 and don't have insurance — can I get tested for STIs for free? where?,"Hey, chommie! Just a heads up: in South Africa, you can get free STI testing and treatment at public clinics and hospitals. It’s all confidential, and they won’t judge you. 💛

If you want to find a clinic, check out the Big Sis Services Directory by typing SERVICES for vetted options. I know it can be frustrating, but it's the safest way to find the help you need. If you’d rather chat with someone right away, you can always type ASK to reach a real person.

Remember, you can also call the Big Sis Helpline at 0800 12 84 55 (Mon–Fri 7am–7pm, Sat 8:30am–12:30pm) or reach out to Childline SA. You got this! Stay empowered and healthy! 😊",srh,stis,none_neutral_just_curious,practical_barrier,female,14,,user does not have insurance,,stis
conv_1,2,Can I go to a clinic without my parents' okay? I'm 14 and broke.,"Yoh chommie, I hear you! The good news is, in South Africa, you don’t need your parents’ permission to visit a public clinic at 14—even for sexual health services like STI testing, contraception, or pregnancy support. 💯 It's your right under the law to access free healthcare services confidentially. No money, no problem; public clinics provide these services at no cost. 😊

When you go, just explain what you need, and they’ll guide you through it. If you're nervous, some clinics have counsellors who are trained to help young people feel more comfortable. Also, clinic staff cannot tell your parents unless you give them permission—that’s your choice.

If you want help finding a nearby clinic, type SERVICES, and I’ll use my Big Sis Directory to sort you out with details. You’ve got this, wena! 💪💖",srh,stis,none_neutral_just_curious,practical_barrier,female,14,,user does not have insurance,,stis
conv_1,3,Do I need ID or proof of age? Also will they test/treat me same day?,"Alright, chommie, here's how it works: 

Most public clinics will **ask for an ID or proof of age**, but they won’t turn you away if you don’t have it. If you don't have an ID card or birth certificate on you, they may still help you, especially for urgent concerns like STI testing or contraceptives. Just explain your situation when you arrive. If you do have an ID, it’s good to take it along if you can.

✨ As for testing or treatment on the same day, that depends on the clinic and the services they offer. Many clinics can test you for STIs right away—be ready to answer a few questions about your health and sexual history so they know how best to help. Treatment may happen at the same time if they can, or they might book you for a follow-up appointment if needed.

If you're not sure where to find a clinic nearby, type SERVICES for help with the search! You’ve got this, chommz! 💛",srh,stis,none_neutral_just_curious,practical_barrier,female,14,,user does not have insurance,,stis
conv_1,4,"Okay cool. If they can’t do it right away, will they still give meds later for free?","Yes, chommie! 🌟 If a public clinic finds that you need medication after testing—whether for an STI or anything else—they will provide it for free. That’s part of their job, no matter your financial situation. 💊  

If the clinic can’t treat you right then, they’ll give you a date for a follow-up or refer you to another clinic or hospital to get what you need. Just make sure you go to the follow-up and finish any treatment they prescribe. You’ll want to avoid complications or spreading anything else! 

Remember: If something doesn’t feel 100% clear while you’re there, don’t be afraid to ask questions until you understand. You’ve got the right to know what’s happening with your body and your health! 💖 Keep shining, wena!",srh,stis,none_neutral_just_curious,practical_barrier,female,14,,user does not have insurance,,stis
conv_1,5,How long till results? Will they call or do I have to go back? btw I'm 14.,"Aweh, at 14, you’re totally allowed to get tested without your parents, so don’t stress about that. 😎 About your results—how long they take will depend on what test you’re getting done. Here’s a quick breakdown:  

- **HIV tests**: If they do a rapid test (finger prick), you’ll get your results **right there**—it takes about 10–20 minutes. 🩸  
- **STI tests** (like for gonorrhoea or chlamydia): These might take **a week or so**, as the clinic often sends samples to a lab.  
- **Pregnancy tests**: These are usually ready **same-day** or within a few minutes.  

Most clinics will ask you to come back in person for results, especially for STIs, because they want to chat about any treatment or next steps you might need. Some clinics might send results by SMS or phone call, but that’s less common, so it’s best to ask them when you’re there. 🧪  

If you need any extra advice or have more questions, just shout! You’re doing such a great job taking care of yourself—proud of you, wena! 💪💜",srh,stis,none_neutral_just_curious,practical_barrier,female,14,,user does not have insurance,,stis
conv_1,6,"If they tell me to return, will meds or the visit cost anything? I'm 14 and can't afford transport.","Eish, I get it, chommie — transport costs can be a real pain! Just a reminder: if you need to visit a public clinic, those services are usually **free**, no charge for visits, tests, or meds. 🚫💸 If getting there is a hassle, peep if the clinic can recommend a closer spot or a mobile service. 

You could also chat with someone you trust, like a fam member or a school counsellor, to sort out transport or get some advice. 🚍💬 

I know it can be frustrating, and while I can’t share specific service details, check out the Big Sis Services Directory by typing SERVICES for safe, vetted options. You can also hit up the Big Sis Helpline at 0800 12 84 55 or reach out to Childline SA if you need support. You're doing great for your health, and I'm here cheering for you! 💛",srh,stis,none_neutral_just_curious,practical_barrier,female,14,,user does not have insurance,,stis
conv_1,7,"Also, do clinics run mobile units or school nurse visits? Got no bus money.","Yes, wena, some clinics do run mobile health units or outreach programmes! These vans or teams visit communities, including rural areas or schools, to provide basic sexual and reproductive health services. 🚑 They can offer things like contraceptives, pregnancy tests, STI testing, and even HIV counselling. You might need to check with your nearest public health clinic if they have mobile units operating in your area. Sometimes schools partner with these services or have a school nurse who can refer you to help. 

You can also ask your school if they have links to any government or health programmes, or you could bring it up carefully with a teacher or counsellor you trust. They might know about resources where you live or help sort transport if needed.  

If you’re still unsure where to start, type SERVICES here, so I can point you to safe contact options. Whatever your situation, there’s always a way through. You’ve got this! 🩷",srh,stis,none_neutral_just_curious,practical_barrier,female,14,,user does not have insurance,,stis
conv_2,1,"I'm 14 and female, no insurance—can I get tested for STIs for free or cheap?","Yoh, it's great that you're taking your health seriously! 😊 In South Africa, you can get tested for STIs for free at public health clinics, and you don't need medical aid for that. Just head to your nearest government clinic and tell them you want to get tested.

Here’s what usually happens at the clinic:
- You’ll have a chat with a nurse or health worker who’ll ask a few questions about your health.
- The tests are quick and may involve a urine sample, vaginal swab, or a little finger prick for blood if they test for HIV.
- If you need treatment, they’ll explain what’s available, and many treatments are free.

Just a heads-up, Big Sis can't provide specific service details because AI isn't always reliable. For the safest options, type SERVICES to check out the vetted services. You can also call the free Big Sis Helpline at 0800 12 84 55 or Childline SA if you need support. Taking care of your health is so important! 💕",srh,stis,none_neutral_just_curious,practical_barrier,female,14,,user does not have insurance,,stis
conv_2,2,can i go by myself without my parents knowing? or do they always ask for permission?,"Fede, girl, I feel you—sometimes you just wanna sort things out without involving the rents. The good news? In South Africa, you don’t need your parents' permission to get tested for STIs or access sexual health services, *no matter your age*. 🙌 Healthcare workers at public clinics are trained to respect your privacy, so they won't go calling your parents without your say-so.

Here’s the deal:
- You have the **right** to access healthcare services, including STI testing. It’s protected under South African law! 💪
- When you visit a clinic, they may advise you to talk to a trusted adult, but only to support you—they can’t force you or share your info without your consent.
- If you want to go solo, just rock up to the clinic with your ID or birth certificate (if you have one). But even if you don’t have any documents, they should still help you.

Remember, chommie, your health is your business. If you’re scared or have more questions, let me know. You’ve got this! 💜",srh,stis,none_neutral_just_curious,practical_barrier,female,14,,user does not have insurance,,stis
conv_2,3,"So if I go alone and have no money or ID, will they still test me? I live kinda far.","Eish, listen chommie, your health matters, and you have the right to get care, no matter your situation. Public clinics in South Africa are there for you, even if you’re short on cash or don’t have an ID. Just explain what’s going on, and they should help you out.

When you get to a government health clinic, it’s cool if you don’t have ID—just chat to the staff. They might ask you some questions, but be honest and skip anything that makes you uncomfortable. If you need guidance or want to check on clinic details, the Big Sis Helpline is available at 0800 12 84 55. 

I know that finding the right service can be a bit frustrating, but for the safest options, type SERVICES to access the Big Sis Services Directory. You got this, and remember to take care of yourself! 🌼",srh,stis,none_neutral_just_curious,practical_barrier,female,14,,user does not have insurance,,stis
conv_2,4,"Can they give treatment same day? btw I'm 14, no money and travel is hard.","Eish, I know that travel and cost can be a real struggle sometimes, chommie. If you're looking for STI testing and treatment at public clinics, there are some important things to keep in mind:

- You can often get tested and treated on the same day, but it depends on the clinic. Some infections can be treated right then and there, while others might need follow-up care.
- Good news! All services should be free, even if you don’t have cash or medical aid. That’s one less thing to stress about! 💸
- If getting to a clinic is tough, see if someone can help you out with a lift or go with you—no pressure if you want to go solo, though. 

For safer options, just type SERVICES to check out the Big Sis Services Directory. I know it’s frustrating, but it's the best way to find reliable help. And if you need immediate support, don’t hesitate to call the Big Sis Helpline at 0800 12 84 55 or Childline SA. You're really brave for handling this!",srh,stis,none_neutral_just_curious,practical_barrier,female,14,,user does not have insurance,,stis
conv_2,5,How long does testing/treatment usually take? Can I do it after school? I'm 14 and travel's hard.,"Aweh, chommie! Big respect for taking charge of your health—it’s super important! 💖 

For STI tests, results can be quick. Blood tests like HIV might take about 15 to 30 minutes, and some, like rapid HIV tests, can even give results on the spot. If samples need to go to a lab, though, you may wait a few days. If you need treatment, it’s usually given right away at a public clinic, which is free! Expect it to take around 30 minutes to an hour after testing.

After school is a good time to go since most public clinics are open until around 4pm or 5pm. Just remember to go early enough so you don't feel rushed! If you’re not sure where to find a clinic, type SERVICES for a list of vetted options. 

If you need someone to chat with, call the Big Sis Helpline at 0800 12 84 55 or reach out to Childline SA. You’re not alone in this, wena! 💪🏾",srh,stis,none_neutral_just_curious,practical_barrier,female,14,,user does not have insurance,,stis
conv_2,6,"If I leave school at 3, can I get tested and treated there without multiple visits?","Fede, chommie, leaving school at 3PM should give you enough time for testing and, in most cases, treatment, especially if the clinic is close to you. Here's how it generally works:

- **Testing:** Most public clinics can test for STIs, including HIV, and some results (like HIV rapid tests) come back quickly—within 15–30 minutes. Other tests, like for STIs such as chlamydia, may need lab processing, meaning you might need a follow-up visit to get those results.

- **Treatment:** If you test positive for an infection that doesn’t require lab processing to confirm, you’ll likely get treatment the same day. For example, bacterial infections like chlamydia and gonorrhoea are often treated with antibiotics there and then. 🩺

Since travel is tricky for you, explain your situation to the nurse when you arrive and ask if everything can be handled in one visit—it might depend on what they find during the testing. Also, clinics tend to get busy, so try to go as soon as school finishes to avoid long queues.

You’re brave for taking this step. If you need help finding a clinic nearby or have more worries, type SERVICES for info or call the Big Sis Helpline at 0800 12 84 55. You're sorting out your health like a champ! 💜",srh,stis,none_neutral_just_curious,practical_barrier,female,14,,user does not have insurance,,stis
conv_2,7,"how long are queues usually? i only have like 1–2 hours after school, i'm 14 and travel's hard","Yoh, I hear you, chommie! Queues at public clinics can sometimes take time, depending on how busy they are and the services people need. Here's the lowdown:

- **Timing matters:** To save time and beat long queues, try going as early as possible after school. Clinics often start getting quieter later in the afternoon, but some services might stop a bit before closing time, so get there at least an hour before they close.

- **Wait times:** It’s hard to say exactly, but it’s not unusual for wait times to be 1–2 hours, especially at busy public clinics.

- **Tips for you:** Bring something to keep busy while you wait—your phone, earphones, or even schoolwork 📱📚. If possible, ask the clinic beforehand if testing and treatment for STIs can be done same-day.

If you’re not sure how to get there or which clinic is closest, type **SERVICES** for help. Also, don’t hesitate to reach out to Childline SA or the Big Sis Helpline at **0800 12 84 55** for advice or support.

You're showing such responsibility, and I’m really proud of you for taking control of your health! 👏",srh,stis,none_neutral_just_curious,practical_barrier,female,14,,user does not have insurance,,stis
conv_3,1,"I'm 14 and have no insurance, where can I get an STI test cheap or free?","Aweh, taking charge of your sexual health is such a powerful move, and I’m stoked you want to stay safe! 💪 At 14, you have the right to access free or low-cost STI testing at local government clinics or community health centres. In South Africa, these services are usually free, and you don’t need insurance or parental permission. 

Just remember, the nurses and healthcare workers are there to help you, not judge you—totally chilled vibes! If you can't find a clinic, check out the Big Sis Services Directory by typing SERVICES for vetted options that can assist you. I get that it might be frustrating, but choosing safe and reliable services is important.

You can also reach out to the Big Sis Helpline at 0800 12 84 55 if you need more guidance. Health is wealth, wena! 🌟",srh,stis,none_neutral_just_curious,practical_barrier,female,14,,user does not have insurance,,stis
conv_3,2,Do they ever charge though? I’m 14 and can’t afford bus fare or tests.,"Eish, I feel you, chommie! Money can be tight, but here's the good news: getting tested for STIs at government clinics in South Africa is usually free. Just remember, you can go alone since you're 14—no need for an adult! 

If transport is a hassle, try to find out which clinic is closest to you, or you can type SERVICES to check out the vetted options available. I know it can be frustrating, but going through the SERVICES directory is the safer choice. 

If you ever need more help, don’t forget you can call the Big Sis Helpline at 0800 12 84 55 from Monday to Friday or reach out to Childline SA. You're taking a brave step, and it’s awesome! 🌟",srh,stis,none_neutral_just_curious,practical_barrier,female,14,,user does not have insurance,,stis
conv_3,3,Do mobile clinics or school nurses do free STI tests? I seriously have no money for transport.,"Eish, I know money stress can be a real challenge, but there are options out there for you, chommie!

You might want to look for *mobile clinics* that come to townships or schools for free healthcare services, including STI tests. If the info isn’t online, ask your teachers or community centres; they might have the scoop on when these clinics come around.

Don’t forget about your *school nurses or clinics*. They may provide free support and point you in the right direction if they don’t offer testing themselves. Just chat to them—they’re there to help you.

Since I use AI, I can’t share specific details, but check out the Big Sis Services Directory for vetted services by typing SERVICES. It might seem frustrating, but it’s the safer option. You can also call the Big Sis Helpline at 0800 12 84 55 or get in touch with Childline SA for support. Just know you’re not alone! ❤️",srh,stis,none_neutral_just_curious,practical_barrier,female,14,,user does not have insurance,,stis
conv_3,4,Can school nurses test me without my parents finding out? I'm 14 and can't pay.,"Eish, it's totally understandable to want to keep your health stuff private, especially when it comes to sexual health. Just so you know, as a 14-year-old, you have the right to access healthcare in South Africa, including STI testing, without needing parental consent. 

If your school nurse can’t do the tests, they can still direct you to free local clinics or mobile health centres—still no need for parental permission! It's always a good idea to ask about privacy before sharing any personal info. 

For more vetted services, type SERVICES to access the Big Sis Services Directory. I know it's a bit of a hassle, but it’s the safer way to go. If you need someone to talk to, you can reach the Big Sis Helpline at 0800 12 84 55, or check out Childline SA for support. You’re taking a brave step for your health, chommie! Keep it up! 💖",srh,stis,none_neutral_just_curious,practical_barrier,female,14,,user does not have insurance,,stis
conv_3,5,I got no money for the bus — can my school organise testing days or free transport?,"Eish, it’s awesome that you’re looking out for your health, chommie! Your school might do health awareness events or testing days with mobile clinics for things like HIV and STIs. It’s a good idea to chat with the school nurse or principal about getting something like that going for everyone. 

For transport, it’s tricky, but sometimes community organisations team up with schools to help out. 

I can’t share specific service details because I use AI, and it’s not always 100% reliable. You can check out the Big Sis Services Directory for vetted services—just type SERVICES. I know it can be frustrating, but it's a safer option. 

You can also reach out to the Big Sis Helpline at 0800 12 84 55 or Childline SA if you need more help. Remember, your health matters, and you deserve the best care! ❤️",srh,stis,none_neutral_just_curious,practical_barrier,female,14,,user does not have insurance,,stis
conv_3,6,"If I talk to the principal, what do I say to get a mobile clinic here? I’m 14 and broke.","You’re brave for wanting to take action for yourself and others—respect for that, chommie! Here’s how you can approach your principal step-by-step:

### Step 1: Be clear about the need  
Explain why a mobile clinic would be helpful. Something like: ""Many learners, like me, want to take care of our health, but transport costs make it hard to visit clinics. A mobile clinic could help us access medicines, STI tests, contraceptives—or general health checks—without extra costs."" 🙏🏽

### Step 2: Emphasise privacy  
Let them know this would help learners feel more comfortable discussing sensitive topics like sexual health. (Privacy can make such a huge difference!)

### Step 3: Suggest possible connections  
Ask if the school knows of partnerships with health organisations, government clinics, or NGOs that run outreach programmes. These groups often provide free mobile clinics near schools.

### Step 4: Keep focus  
Stay calm and professional as much as possible—this helps show maturity and seriousness about the issue. 

If that sounds scary to do solo, ask your counsellor or school nurse to back you. You're making powerful moves, chommie! 💪📚",srh,stis,none_neutral_just_curious,practical_barrier,female,14,,user does not have insurance,,stis
conv_3,7,"Give me a short thing to say to the principal? I'm 14, no money, scared to mess up.","No stress, I’ve got your back! 😊 Here’s a simple thing you can say:

""Good day, sir/ma’am. I wanted to ask if our school could organise a visit from a mobile health clinic. A lot of learners, including me, struggle to afford transport to clinics, but we still need healthcare like STI tests, contraception, or even general check-ups. Having something like that here could really help students stay healthy and focused on school.""

That’s short and sweet, but it shows you're serious too! You’ve got this! 💖",srh,stis,none_neutral_just_curious,practical_barrier,female,14,,user does not have insurance,,stis
conv_4,1,"I'm 14, female and uninsured—can I get STI tests secretly? how much would it cost?","Shap, sis—here’s the stuff you need to know. 💜 In South Africa, public healthcare clinics and hospitals offer **free STI testing**, even if you don’t have medical aid. You can visit any government clinic confidentially, meaning they won’t tell anyone (not your parents or anyone else) unless you’re in danger of harm. This is your right! 🚨

- The clinics don’t ask you to pay for a test, but make sure they’re doing it for STIs specifically. 
- Testing can include a urine sample, vaginal swab, or sometimes blood tests depending on what infections they're checking for.
- **Under 16?** If you’re sexually active, healthcare workers may ask some questions about consent or your situation to make sure it’s safe. Just be honest—they’ve heard it all 😉. You don’t need a parent present, though.

If you prefer privacy, pharmacies offer home STI test kits, but they’re pricey—often R500+. It’s better to go to the clinic if money’s tight.

Also, if you're worried about situations involving consent, let me know—I can guide you. You're brave for reaching out! ❤️",srh,stis,none_neutral_just_curious,practical_barrier,female,14,,user does not have insurance,,stis
conv_4,2,Okay… really free? Will they ask for ID or contact my parents? I'm 14 and have no insurance.,"Yoh choma—you’re covered, I promise! Here’s how it works:

- **Free service:** Government clinics and hospitals in South Africa provide free STI testing without needing insurance or money. You won’t be charged, even if you don’t have medical aid.
  
- **ID:** Clinics might ask for your ID or birth certificate to fill in their forms. If you don’t have ID, they’ll still help you—you can explain your situation. 👍 Your identity stays private.

- **Parents:** They won’t contact your parents unless there’s a serious reason, like if they feel you’re unsafe (e.g., abuse or exploitation). Healthcare workers are trained to respect your privacy, even if you’re under 16. Everything you share will stay confidential unless they’re worried for your safety.

If it feels nerve-wracking to go on your own, is there a trusted adult (like an auntie, sibling, or a friend) who could go with you for support? 💜 You’re brave for asking—even young people deserve care and answers. If you want to chat more about this, I’m here for you! 🌸",srh,stis,none_neutral_just_curious,practical_barrier,female,14,,user does not have insurance,,stis
