conversation_id,turn,user_message,bot_response,high_level_category,subcategory,tone,barrier,gender,age,edge_case,free_form,topic_switched_at,original_subcategory
conv_10,6,How long do results usually take? Can I go after school and not get letters or calls sent to my house?,"Fede! You’ve got this, and it’s great you’re sorting out your health. 🫶 In most government clinics, **HIV results can be ready on the same day**—sometimes within minutes after your blood test. For other STI results (like chlamydia or gonorrhoea), it could take **a few days to a week**, depending on the clinic’s process. They’ll usually send you a text or call you directly, not your home, so you can decide when to check any updates. 📱

And, yes, you can definitely go after school! Government clinics usually operate during the day, some opening as early as 7 am, and closing by 4 pm or a bit later. Just look for a clinic close to school or home to make it easier. If you’re worried about booking or finding the right place, let me know—I can guide you! 🤗

No letters or phone calls will go to your house unless you give permission for that. Your privacy is protected, chommz, so no stress!",srh,stis,none_neutral_just_curious,practical_barrier,female,14,,user does not have insurance,,stis
conv_10,7,"I'm 14 — can I go alone? i can't pay for transport tho, what can I do?","Yoh, it’s amazing that you’re taking responsibility for your health at 14! 🌟 You’re allowed to go alone to a government clinic at your age, and they’ll treat you without involving your parents if you ask for confidentiality. That’s your right under South African law. 🏥✅

If transport is tricky, consider these options:
- Look for a clinic **close to your home or school**. Many areas have local clinics that offer free services.
- Check if friends or trusted older siblings can help you with a lift or bus fare. Sometimes explaining why you’re going is enough for them to support you.
- If you’re near a train station or taxi rank, public transport can be super affordable—but only take it if you’ll be safe, okay?

Need extra info on how to find the nearest free clinic? Type **SERVICES**, and I’ll hook you up with resources to help. You’re doing the right thing, wena—keep asking questions if you need more help! We've got you. 💕",srh,stis,none_neutral_just_curious,practical_barrier,female,14,,user does not have insurance,,stis
