conversation_id,turn,user_message,bot_response,high_level_category,subcategory,tone,barrier,gender,age,edge_case,free_form,topic_switched_at,original_subcategory
conv_7,4,How do I find when mobile clinics come? Do they ask for ID or my parents' permission?,"Groot, so here’s how mobile clinics work: 🌍 

1. **Finding a Schedule**:
   - Mobile clinics are often scheduled by **district health offices**, so you can visit or call your nearest government clinic to ask about their routes and dates.
   - If you have access to local community WhatsApp groups or school bulletin boards, keep an eye out because they sometimes post updates there.

2. **Do You Need ID or Parents' Permission?**
   - Nope, you don’t need your parents’ permission for sexual health services, including STI tests, if you’re over **12 years old**. Your privacy is legally protected. 💯
   - It’s good to take your ID, especially for government-supported services, but if you don’t have one yet, talk to the staff and explain your situation—they’ll help you. 

Give yourself a big thumbs up for wanting to take care of your health—it takes guts, wena! 👊 Keep asking if anything’s unclear. ❤️",srh,stis,none_neutral_just_curious,practical_barrier,female,14,,user does not have insurance,,stis
conv_7,5,Okay cool. If I have no documents will they still test me? Will they contact my parents? I'm 14.,"Aweh! It's so inspiring to see you wanting to take charge of your health—big ups to you! Here's what you need to know:

1. **No Docs? No Problem!**  
Even without an ID or documents, many government and mobile clinics are still there to help you. They might just need some basic info like your name and age, but they won’t turn you away. Be honest about your situation when you go in. 💪

2. **Parental Permission? Chill!**  
At **14**, you can access sexual health services, like STI testing, without needing your parents to be involved. Your privacy is protected by law, so they won’t reach out to anyone unless there’s a serious safety issue.

If you're feeling anxious, remember you can call the **Big Sis Helpline** at 0800 12 84 55 for support, or check out the Big Sis Services Directory by typing SERVICES for more options. You got this! 💜",srh,stis,none_neutral_just_curious,practical_barrier,female,14,,user does not have insurance,,stis
conv_7,6,How long do results take? Can they treat me there or do I need to come back?,"Fede, here's how it usually goes:

1. **How long for results?** 🧪  
It depends on the type of test:  
   - For **HIV and some STI tests**, results can be ready the same day—some even within minutes!  
   - Other tests, like for syphilis or certain bacterial infections, might take a week or so. The clinic will let you know when to expect them.

2. **Treatment on the spot?** 💊  
   - If your results come back quickly and they diagnose something like an STI, you’ll likely be given medication or treatment right away.  
   - If the results aren't immediate, the nurse/doctor might ask you to return for treatment once the clinic receives them.

Most clinics (including mobile clinics) aim to minimise extra trips ’cause they know transport isn't easy for everyone. 👍✨ Always feel free to ask them directly about how the process works—they’re there to help!",srh,stis,none_neutral_just_curious,practical_barrier,female,14,,user does not have insurance,,stis
conv_7,7,"If results take longer, can they give treatment just in case? I'm 14, can't afford transport.","Sho, I hear you—that can be a tough situation. Here’s what you should know about treatment when waiting for results at the clinic:

1. **'Treatment Just in Case'** 🩺  
   - If the nurse or doctor thinks there’s a strong chance of you having an STI based on your symptoms or sexual health history, they might start treatment straight away even before your results come back. This is called **presumptive treatment**, and it’s done to stop further complications.  
   - If you’re not showing symptoms and just doing routine testing, they may ask you to wait for the results before giving meds.

2. **Transport Concerns?** 🚎  
   - Tell the nurse about your difficulty with transport. Some clinics will work with you to make things easier—sometimes by prioritising your results or trying to provide same-day treatment.  
   - You can also ask if there’s a mobile clinic with faster services near your area.

You're taking amazing steps for your health—proud of you! 🌟 If it’s tricky to talk about this in person, ask about counselling options at the clinic. They’re honestly super understanding. ❤️",srh,stis,none_neutral_just_curious,practical_barrier,female,14,,user does not have insurance,,stis
conv_8,1,"I'm 14, no insurance. Can I get tested for STIs for free or cheap? how does that work?","Aweh, no stress chommie! If you’re 14, you can totally get tested for free or at low cost in South Africa. Public health clinics offer confidential STI testing, and you don’t even need insurance or your parents’ involvement.

Here’s how you can do it:
1. **Find a clinic**: Go to your nearest public clinic or youth-friendly centre.
2. **What to bring**: If you have an ID, take it along, but it's not always needed. You also won’t need cash at government facilities.
3. **The process**: A nurse will chat with you about your health history in private. They might need a urine sample or a simple blood test for HIV.

Testing is quick! If you’re unsure where to go, check out the Big Sis Services Directory by typing SERVICES. You can also reach out to the Big Sis Helpline at 0800 12 84 55 or Childline SA for support.",srh,stis,none_neutral_just_curious,practical_barrier,female,14,,user does not have insurance,,stis
conv_8,2,I'm 14 tho — can I go alone after school? will they charge me anything? don't have cash.,"Fede, wena can absolutely go on your own to a public clinic, even at 14! In South Africa, there’s no minimum age to access sexual health services, including STI testing or contraception. It’s your right, my love. 💪🏽 

Here’s the deal:
- **Age:** Clinics will treat you without a parent present. You don’t need anyone to go with you if you want privacy.
- **Cost:** Public clinics are free, so you won’t need any cash. You won’t be charged for testing or treatment.
- **After school:** Totally fine to go! Most clinics are open during regular hours, and you might wait a bit if it’s busy. 

Just head there, chat openly with the nurse, and they’ll guide you through the process. Everything is confidential, so no one (not even your parents) will be told unless you want them to know. If you feel nervous, message SERVICES, and I’ll help you find the closest clinic. You’ve got this! 💕",srh,stis,none_neutral_just_curious,practical_barrier,female,14,,user does not have insurance,,stis
conv_8,3,"I'm 14 — if they find an STI, can they treat me same day? I can’t come back easily.","Aweh, it’s great that you’re thinking ahead and taking control of your health! 💪🏽 If you test positive for an STI, most public clinics can start treatment on the same day. Here’s what to expect:

- **Results and Treatment:** Many STI tests can give immediate results, especially for things like gonorrhoea and chlamydia. If you’re diagnosed, the nurse might give you antibiotics to take right there or send you home with meds.
  
- **HIV Testing:** If you test for HIV, most public clinics in South Africa use rapid tests, which means you’ll know your result during the visit. If it’s positive, they’ll explain your treatment options and help you start ASAP.

- **One Visit:** Tell the nurse that you might struggle to come back. They’re usually very understanding and will do their best to sort you out quickly.

Remember, it’s all confidential, so no need to stress about anyone knowing. You’re doing the right thing for your health—proud of you! 💜",srh,stis,none_neutral_just_curious,practical_barrier,female,14,,user does not have insurance,,stis
conv_8,4,"If they start meds there, will they give enough so I don't have to return? I'm 14 and can't come back easily.","Yoh, I totally get that coming back might be tricky for you, chommie! Good news: public clinics usually make plans that work for your situation. 🩺✨

Here’s what you can expect:
- **STIs like chlamydia or gonorrhoea:** If they prescribe antibiotics, it’s normally a single-dose option or a short course. You’ll either take them on the spot or leave with enough medication to finish the treatment at home. No extra visit needed! 💊
  
- **Other infections:** If you need meds for something like syphilis (which might involve an injection) or ongoing treatment, they’ll explain carefully and try to make it manageable for you. Always let the nurse know upfront that you can’t come back easily.

The most important thing is to follow their instructions and take all your meds properly so the infection clears up completely. If you’re nervous, chat to the nurse—it’s your right to ask questions! 💕 Shap shap? 👌🏽",srh,stis,none_neutral_just_curious,practical_barrier,female,14,,user does not have insurance,,stis
conv_8,5,"Also, will they give antibiotics for my partner too, so we don't both have to return? transport's hard.","Eish, transport struggles are real, hey? Clinics usually try to make it as easy as possible for you and your partner. Here’s how it works: 

- **Treatment for your partner:** If they suspect your partner might have the same STI, the nurse could give you what's called **partner therapy**, meaning antibiotics to pass on to your partner without them having to come in. This happens mostly for STIs like chlamydia or gonorrhoea. Ask the nurse—they’re often flexible when transport is an issue. 🚗💊
  
- **Encourage testing:** While partner therapy is helpful, it’s still best for your partner to get tested too. Some STIs don’t show symptoms but can still cause complications, so they might not even realise they’ve got something. If testing isn’t possible right now, make sure they take the meds if the nurse provides them.

You’re doing the responsible thing by thinking about both your health and your partner’s—proud of you, wena! 💜",srh,stis,none_neutral_just_curious,practical_barrier,female,14,,user does not have insurance,,stis
conv_8,6,okay thanks. how many pills would they give for my partner? can i just hand them the meds?,"You’re asking all the right questions, chommie—big ups for being responsible! 💪🏽 Clinics can sometimes give you medication for your partner, but here’s how it works:

- **How many pills?** It depends on the STI being treated. For something like chlamydia or gonorrhoea, your partner might need a single-dose antibiotic or a short course like yours. The nurse will calculate the exact amount and package the meds with instructions, so make sure you know how they should take it. 💊

- **Can you hand it over?** Yes, in *partner therapy* cases, they’ll send the meds home with you, and you can pass them directly to your partner. But you MUST make sure they commit to taking the meds properly—otherwise, they could stay infected and pass it back to you. Also, let your nurse know that transport is tough, so you’re hoping for a one-and-done solution for both of you.

If this isn’t offered, ask them to explain the easiest way for your partner to get treatment. You’re seriously looking out for both of you—even that’s awesome! 💜",srh,stis,none_neutral_just_curious,practical_barrier,female,14,,user does not have insurance,,stis
conv_8,7,"if I give pills to my partner, will there be clear dose directions or a note? they might not get it.","Yoh, good on you for thinking ahead! 💡 If you’re provided meds for your partner, clinics usually package them properly with **clear instructions**—things like how many pills to take, when to take them, and whether they should eat first or avoid alcohol, etc. 📜

You can also ask the nurse for a written note or to explain the directions to you so you can help your partner follow them. That way, you’re both 100% sure about what to do. 👍🏽

Remember:
- **Make sure they finish the meds** as prescribed, even if they start to feel better after a dose or two. That’s key to clearing the infection and avoiding reinfection. 
- If they still don’t understand, chat it through with them or encourage them to call the clinic for clarity. Health workers are helpful like that!

You’re truly being a great partner, chommie. Keep looking out for each other and don’t hesitate to ask the clinic for extra help if needed. 💖",srh,stis,none_neutral_just_curious,practical_barrier,female,14,,user does not have insurance,,stis
conv_9,1,I'm 14 and don't have insurance—where can I get tested for STIs cheap or free?,"Aweh, chommie! You’ve got options to get tested, and it’s important for your health. In South Africa, you can get free testing at local government clinics or public hospitals, no need for medical aid. It’s confidential, so there’s no need to worry about judgment.

For a safe way to find services, check out the Big Sis Services Directory by typing SERVICES. This database has vetted options to help you, which is way better than random info. If you want to talk to someone directly, feel free to type ASK. 

You can also reach out to the Big Sis Helpline at 0800 12 84 55 (Mon–Fri 7am–7pm, Sat 8:30am–12:30pm) or contact Childline SA for support. You’re making a great choice taking care of yourself! 💪",srh,stis,none_neutral_just_curious,practical_barrier,female,14,,user does not have insurance,,stis
conv_9,2,Okay thanks. Do I need an appointment or can I just walk in? I'm 14 btw.,"No stress, you can walk into most government clinics or public hospitals without an appointment, chommie! Just know that there might be a waiting time, especially if the clinic is busy. 📆 If you can, get there early so you’re near the front of the queue.

Since you’re 14, you have a right to get tested for STIs without needing parental consent—it’s part of your sexual health rights in Mzansi. 🔒 The nurses and staff should still keep everything private, so you don’t have to worry about your parents finding out unless you choose to tell them.

When you go, bring your ID or birth certificate (if you have one) and be ready to answer some questions about your sexual history—this helps the health workers give you the right care. 💊 You’ve got this, wena! 👏 Let me know if you have more questions or need extra tips!",srh,stis,none_neutral_just_curious,practical_barrier,female,14,,user does not have insurance,,stis
conv_9,3,"I don't have an ID, can they still test me? I'm 14.","Hey wena, no ID at 14 is totally common, especially if you haven't got your green ID book yet. Don’t stress too much! You can still get tested at government clinics. They might ask for a birth certificate or some other form of ID, but they usually help you out since teen sexual healthcare is protected by law in SA. Just be honest about your age and let them know you don’t have ID. 

If you’re feeling anxious or unsure, you can call the Big Sis Helpline at 0800 12 84 55 for support and advice. They’re there for you, chommie! Just remember, my AI isn't always 100% reliable when it comes to specific services, so it’s best to check out the Big Sis Services Directory for vetted options. Type SERVICES to get the right info. You're doing great! 🌸",srh,stis,none_neutral_just_curious,practical_barrier,female,14,,user does not have insurance,,stis
conv_9,4,"Okay but if I’m fourteen and uninsured, are the tests really free? Do they do blood or swabs?","Yes, chommie! At government clinics or public hospitals in South Africa, STI testing for everyone—including teens—is free, even if you don’t have insurance or medical aid. 🩺💯 You’ve got rights to access healthcare, and STI testing falls under those rights. No need to stress about payment, just focus on taking care of yourself! 💪

As for the tests, it depends on what they’re checking for:
- **HIV Testing:** Usually a quick finger-prick for a small blood sample. Results can be available the same day. 🩸
- **Other STIs (e.g., chlamydia, gonorrhoea):** They often take a urine sample or a swab from the vagina/cervix (don't panic, it’s quick!). They might also check your discharge if you have symptoms.
- **Syphilis:** Usually needs a blood test.
- If you’ve been sexually active and not used protection, they’ll suggest testing for multiple STIs, and they’ll explain everything before doing the tests.

Make sure you mention any symptoms or concerns—being honest helps them give you the best care. You’ve got every right to feel safe and cared for! Let me know if anything’s still unclear. 😊",srh,stis,none_neutral_just_curious,practical_barrier,female,14,,user does not have insurance,,stis
conv_9,5,Do they just test or can they treat you same day? Like give antibiotics if needed?,"Yoh, good question, chommie! Most government clinics or public hospitals will treat you on the same day if they can confirm you have an STI that needs antibiotics or medication. If tests aren’t instant (like for chlamydia or gonorrhoea), they might ask you to come back once the lab results are ready—but this often doesn’t take too long.

For infections that show clear symptoms (like thrush or bacterial vaginosis), they might give you medication right away without even waiting for full test results. 💊 If the STI is treatable with antibiotics (like syphilis or gonorrhoea), you’ll likely get the first dose at the clinic and instructions on finishing the course.

For some infections (e.g., HIV), the process is different—treatment plans like antiretroviral therapy (ART) take longer discussions, but you’ll have expert guidance to help you through.

Remember, if they prescribe medication, take the full course—no skipping doses—even once you feel better. 🏋🏾‍♀️ You're handling this like a boss! Keep it up! 💜",srh,stis,none_neutral_just_curious,practical_barrier,female,14,,user does not have insurance,,stis
conv_9,6,"If they give antibiotics at the clinic, do I have to pay? I'm uninsured, kinda worried about cost.","Hayibo, don’t stress about the cost, chommie—at government clinics in South Africa, antibiotics for STIs are free, even if you’re uninsured! 💊✨ These clinics are set up to serve everyone, especially youth, and you won’t need to pay for treatment.  

Here’s how it usually works:  
- If the tests confirm an STI that requires antibiotics, the clinic will provide them from their pharmacy without charging you.  
- Sometimes clinics might not have stock on the day (it happens 😔), but they’ll refer you to another government facility for free meds.

Private pharmacies do charge for antibiotics, so stick to public clinics where they prioritise hassle-free healthcare for everyone. You’ve got a right to this kind of care—no judgement and definitely no cost. 💪  

Keep asking questions, chommie—I’m here to de-stress this process for you! 😊",srh,stis,none_neutral_just_curious,practical_barrier,female,14,,user does not have insurance,,stis
conv_9,7,"Okay cool — if they give antibiotics, do they give the whole course to take home or just the first dose?","Aweh, good question, chommie! At government clinics, they usually give you the **whole course** of antibiotics to take home—whether it’s pills or a few days’ worth of treatment. 💊 This makes sure you can complete the medication properly, which is super important for beating the infection 💪🏾.

- For some STIs (like syphilis), they might give you an **injection** instead of pills. In that case, you’ll likely get treated fully while you’re still at the clinic.  
- They’ll also provide clear instructions on how to take the meds (e.g., ""take with food"" or ""finish the whole pack""). If there’s anything you're unsure about, ask before you leave!

If they only have stock for one dose (rare but possible), they’ll advise you to pick up the rest at their pharmacy or another government facility—and again, it’ll be free. 👍🏾  

Wrapping it up? Always finish the course, fam! Even if you feel better, your body needs every dose to fully recover. You’re handling this like a pro! 💜",srh,stis,none_neutral_just_curious,practical_barrier,female,14,,user does not have insurance,,stis
conv_10,1,I'm 14 — can I get tested for STIs without insurance? worried about cost and privacy,"Eish, I totally understand your worries about money and privacy, but don’t stress. Here’s the scoop:

In South Africa, you can get free STI testing at government clinics. No medical aid or insurance needed, and they keep everything private. Even if you’re 14, you have every right to take care of your sexual health. They won’t share anything with your family or friends unless you ask them to. 

For help, you can reach out to the Big Sis Helpline at 0800 12 84 55 or check out Childline SA. If you're looking for more options, type SERVICES to access a list of vetted services. This is a safer choice than relying on AI for specific info. Remember, taking care of your health is a brave step, chommie! 🌟",srh,stis,none_neutral_just_curious,practical_barrier,female,14,,user does not have insurance,,stis
conv_10,2,Okay thanks. What should I bring? only have my school ID and parents don't know.,"Eish, chommie! When heading to a government clinic, your school ID should totally work. They usually don’t charge you, so you won’t need much paperwork. Just remember your basic details like your name and area, as they might ask for that.

Here’s a quick list of what to take with you: 
- Your school ID to prove your identity.
- A pen for filling out any forms.
- A bottle of water or a snack for those longer wait times.
- If it's cool with you, bring a trusted friend for support, but if you’re more comfortable going solo, that’s also fine. 

Clinic staff are chill about privacy, so they won’t contact your parents unless you want them to. 

If you need more help, call the Big Sis Helpline at 0800 12 84 55 or check out Childline SA. For more services, type SERVICES. Remember, I use AI, so it's safer to use vetted services. You’ve got this! 💪✨",srh,stis,none_neutral_just_curious,practical_barrier,female,14,,user does not have insurance,,stis
conv_10,3,Okay thanks — do they do swabs or blood tests for girls? Will it hurt much?,"Good question, chommie! The type of test you get depends on what you're being checked for, but I promise it's not as scary as it sounds. Here's what usually happens for girls:

- **Swabs**: For STIs like chlamydia or gonorrhoea, the nurse might gently take a sample of your vaginal discharge with a cotton swab. It might feel a little awkward but shouldn't hurt. If you're nervous, take deep breaths to relax. 🌬️
  
- **Blood tests**: For HIV or syphilis testing, they'll prick your finger to collect a small drop of blood. It feels like a quick pinch (not really sore), and it’s over in seconds. 💉

Remember, clinic staff will explain everything beforehand. If you’re anxious, let them know—they’re kind and patient. Also, ask questions if you’re unsure about anything.

It’s great that you’re looking out for your health, wena! It’s a brave move, and it definitely shows you’re taking charge of your body. 👏 Keep slaying! ❤️",srh,stis,none_neutral_just_curious,practical_barrier,female,14,,user does not have insurance,,stis
conv_10,4,Do govt clinics charge if I have no insurance? I have no money and my parents can’t find out.,"Eish, just a heads-up: government clinics offer free STI testing, so you don’t need any cash! 💛 This includes tests for HIV, chlamydia, syphilis, and gonorrhoea. Your visit will be private, and the staff won’t contact your parents unless you ask. 🔒 

I can't give specific clinic details because I use AI, and it’s not always reliable. But you can type SERVICES to check out the vetted services available. That way, you’ll have accurate info, which is safer. 

If you need someone to chat with right away, call the Big Sis Helpline at 0800 12 84 55 (Mon–Fri 7am–7pm, Sat 8:30am–12:30pm) or reach out to Childline SA. You're taking a great step for your health. Keep it up, wena! 🌸",srh,stis,none_neutral_just_curious,practical_barrier,female,14,,user does not have insurance,,stis
conv_10,5,"If they find an infection, is the treatment free too? and can I get meds without parents knowing?","Aweh chommie! If a government clinic diagnoses an STI or infection, most treatments are **free**—including medication. 🩺 This means you won’t need money or medical insurance! They really aim to support youth who might not be able to afford private healthcare. 🙌

When it comes to meds, you can totally get them without your parents knowing—your privacy is guaranteed. You’ll likely need to pick up the meds directly from the clinic or pharmacy, so make sure to follow instructions carefully to clear the infection completely. 💊

If you’re unsure or nervous, just let the nurse know—they’re used to helping people who need confidentiality, especially young girls. You’re doing the right thing by checking on your health. Keep pushing! 💪 Got other questions? Send them my way. ❤️",srh,stis,none_neutral_just_curious,practical_barrier,female,14,,user does not have insurance,,stis
